{
  "schema_version": "1.0",
  "session_id": "d2a11e94-080d-4e04-86c4-d284a3255115",
  "agent_id": "fable-cowork",
  "repo": "ihui-core",
  "branch": "feat/DE-11-tracker-parser",
  "task_ref": "DE-11",
  "started_at": "2026-07-31T18:35:00Z",
  "ended_at": "2026-07-31T19:05:00Z",
  "summary": "Parser del tracker markdown (contrato congelado: checkboxes, IDs B/F/DE, prioridad P0-P3, fecha_intake derivada de Git con excepcion unica de arranque via [intake:], marcador manual fuera del arranque se denuncia y se ignora), lector de verificaciones/*.jsonl con cruce tachado-vs-evidencia, historial.jsonl con sello de build. Configurable por env, sin rutas hardcodeadas, fallbacks ruidosos. Probado contra repo Git real: reproduce punto cero 30=24+6, 12 bugs core, cobertura 0.",
  "outcome": "COMPLETADO",
  "claims": {
    "files_modified": [
      "docengine/tracker.py",
      "docengine/generate.py"
    ],
    "adrs_touched": [],
    "prs": []
  }
}